source_id,kind,title,publisher,url,accessed_utc,notes
SRC_EDGAR_FULLINDEX,data,SEC EDGAR Full-Text Quarterly Form Index,U.S. Securities and Exchange Commission,https://www.sec.gov/Archives/edgar/full-index/,2026-05-31T18:43:46Z,"Authoritative enumeration of all filings by form type, CIK, date."
SRC_EDGAR_SUBMISSIONS,data,SEC EDGAR Submissions API (data.sec.gov),U.S. Securities and Exchange Commission,https://data.sec.gov/submissions/,2026-05-31T18:43:46Z,"Per-issuer metadata: name, CIK, SIC, entityType, exchanges, tickers, filings."
SRC_NASDAQ_SYMDIR,data,Nasdaq Trader symbol directory (nasdaqlisted.txt),"Nasdaq, Inc. / NasdaqTrader",https://www.nasdaqtrader.com/dynamic/SymDir/nasdaqlisted.txt,2026-05-31T18:43:46Z,Current Nasdaq listings with market tier category (Q/G/S).
SRC_CA5_VACATUR,rule,"Alliance for Fair Board Recruitment v. SEC (5th Cir., en banc) opinion",U.S. Court of Appeals for the Fifth Circuit,https://www.ca5.uscourts.gov/opinions/pub/21/21-60626-CV0.pdf,2026-05-31T18:43:46Z,"RULE_END_VACATUR=2024-12-11. Verbatim: 'December 11, 2024' and 'review and VACATE SEC's order approving Nasdaq's Board Diversity' rules (No. 21-60626)."
SRC_NASDAQ_FIVE,rule,Board Diversity Disclosure: Five Things to Know,"Nasdaq, Inc.",https://listingcenter.nasdaq.com/assets/Board%20Diversity%20Disclosure%20Five%20Things.pdf,2026-05-31T18:43:46Z,Exemptions and timing guidance.
SRC_NASDAQ_MATRIX,rule,Board Diversity Disclosure Matrix instructions,"Nasdaq, Inc.",https://listingcenter.nasdaq.com/assets/Board%20Diversity%20Disclosure%20Matrix.pdf,2026-05-31T18:43:46Z,Matrix disclosure instructions.
SRC_NASDAQ_NEWLIST,rule,New Companies Listing on Nasdaq (guidance),"Nasdaq, Inc.",https://listingcenter.nasdaq.com/assets/New%20Companies%20Listing%20on%20Nasdaq.pdf,2026-05-31T18:43:46Z,"Basis for due-date formula. Verbatim: 'All operating companies listing on Nasdaq's U.S. exchange have one year from the date of listing to' provide the diversity matrix; 'Whether your company is an IPO or transferring from another exchange, it will have one year'."
SRC_SEC_APPROVAL,rule,SEC Order Approving Nasdaq Board Diversity Rule (Release 34-92590),U.S. Securities and Exchange Commission,https://www.sec.gov/files/rules/sro/nasdaq/2021/34-92590.pdf,2026-05-31T18:43:46Z,"RULE_START=2021-08-06. Verbatim cover: '(Release No. 34-92590; File Nos. SR-NASDAQ-2020-081; SR-NASDAQ-2020-082) ... August 6, 2021'."
